<?xml version="1.0" encoding="UTF-8"?>
<!--
To change this license header, choose License Headers in Project Properties.
To change this template file, choose Tools | Templates
and open the template in the editor.
-->

<!DOCTYPE courses SYSTEM 'timetable.dtd'>
<courses>
    <courseslot code="COMP4711">
        <booking>
            <day>Tuesday</day>
            <start>1430</start>
            <end>1520</end>
            <building>SW5</building>
            <room>1840</room>
            <type>lecture</type>
            <instructor>Jim Parry</instructor>
        </booking>
        <booking>
            <day>Tuesday</day>
            <start>1530</start>
            <end>1720</end>
            <building>SE12</building>
            <room>321</room>
            <instructor>Jim Parry</instructor>
        </booking>
    </courseslot>
    <courseslot code="COMP4735">
        <booking>
            <day>Monday</day>
            <start>1130</start> 
            <end>1220</end>
            <building>SW1</building>
            <room>1205</room>
            <type>lecture</type>
            <instructor>Mirela Gutica</instructor>
        </booking>
        <booking>
            <day>Wednesday</day>
            <start>1330</start>
            <end>1420</end>
            <building>SW1</building>
            <room>1205</room>
            <type>lecture</type>
            <instructor>Mirela Gutica</instructor>
        </booking>
        <booking>
            <day>Thursday</day>
            <start>1130</start>
            <end>1220</end>
            <building>SW1</building>
            <room>1710</room>
            <type>lecture</type>
            <instructor>Mirela Gutica</instructor>
        </booking>
        <booking>
            <day>Thursday</day>
            <start>1530</start>
            <end>1720</end>
            <building>SE12</building>
            <room>322</room>
            <type>lab</type>
            <instructor>Matthew Linder</instructor>
        </booking>
    </courseslot>
    <courseslot code="COMP4985">
        <booking>
            <day>Monday</day>
            <start>0930</start> 
            <end>1120</end>
            <building>SE12</building>
            <room>323</room>
            <type>lecture/lab</type>
            <instructor>Aman Abdulla</instructor>
        </booking>
        <booking>
            <day>Wednesday</day>
            <start>0930</start> 
            <end>1220</end>
            <building>SE12</building>
            <room>323</room>
            <type>lecture/lab</type>
            <instructor>Aman Abdulla</instructor>
        </booking>
    </courseslot>
    <courseslot code="COMP4981">
        <booking>
            <day>Tuesday</day>
            <start>0930</start> 
            <end>1120</end>
            <building>SE12</building>
            <room>323</room>
            <type>lecture/lab</type>
            <instructor>Aman Abdulla</instructor>
        </booking>
        <booking>
            <day>Thursday</day>
            <start>0930</start> 
            <end>1120</end>
            <building>SE12</building>
            <room>323</room>
            <type>lecture/lab</type>
            <instructor>Aman Abdulla</instructor>
        </booking>
        <booking>
            <day>Wednesday</day>
            <start>1230</start> 
            <end>1320</end>
            <building>SE12</building>
            <room>323</room>
            <type>lecture/lab</type>
            <instructor>Aman Abdulla</instructor>
        </booking>
    </courseslot>
    <courseslot code="COMP4560">
        <booking>
            <day>Monday</day>
            <start>1530</start> 
            <end>1720</end>
            <building>SE12</building>
            <room>320</room>
            <type>lab</type>
            <instructor>Brenda Fine</instructor>
        </booking>
        <booking>
            <day>Tuesday</day>
            <start>1130</start> 
            <end>1220</end>
            <building>SW5</building>
            <room>1850</room>
            <type>lecture</type>
            <instructor>Brenda Fine</instructor>
        </booking>
        <booking>
            <day>Friday</day>
            <start>1230</start> 
            <end>1320</end>
            <building>SW3</building>
            <room>1750</room>
            <type>lecture</type>
            <instructor>Brenda Fine</instructor>
        </booking>
    </courseslot>
    <courseslot code="BLAW3600">
        <booking>
            <day>Monday</day>
            <start>1230</start> 
            <end>1420</end>
            <building>SW9</building>
            <room>127</room>
            <type>lab</type>
            <instructor>Catherine Ryan</instructor>
        </booking>
        <booking>
            <day>Friday</day>
            <start>0830</start> 
            <end>1020</end>
            <building>SW5</building>
            <room>1840</room>
            <type>lecture</type>
            <instructor>Catherine Ryan</instructor>
        </booking>
    </courseslot>
</courses>
